{
  "experience_id": "EXP_MM_001",
  "experience_name": "MarketMind AI",
  "experience_type": "PERSONAL_PROJECT",
  "organization": "MarketMind AI",
  "source_of_truth": "marketmind-ai repository (https://github.com/bchaush/marketmind-ai); local primary artifact mirror at C:\\Users\\Bora\\Desktop\\marketmind-ai\\",
  "notes": "Canonical identity for the MarketMind AI project. No verified employer, client, formal sponsor, employment dates, paid status, coursework credit, user counts, or production deployment classification at the Experience layer. Organizational relationship beyond repository ownership is UNKNOWN."
}
