{
  "experience_id": "EXP_DCOMMERCE_001",
  "experience_name": "D Commerce Bank",
  "experience_type": "EMPLOYMENT",
  "organization": "D Commerce Bank",
  "source_of_truth": "D Commerce Bank employer-issued Letter of Reference (Bora-supplied; not stored in repository); Bora-supplied current LinkedIn profile (Bora-supplied screenshot; not stored in repository); evidence/dcommerce/ records referencing EXP_DCOMMERCE_001",
  "notes": "Canonical identity for Bora's D Commerce Bank employment. Reclassified from ORGANIZATIONAL_ENGAGEMENT to EMPLOYMENT following DCOMMERCE_REFERENCE_001 (an employer-issued Letter of Reference, VERIFIED), directly analogous to how EXP_TELUS_001 uses EMPLOYMENT once TELUS_OFFER_001 established a VERIFIED-tier original employment document -- experience.schema.json's own guidance ties this classification to evidentiary authorization, not to whether the underlying relationship was factually employment. Canonical overall relationship per DCOMMERCE_REFERENCE_001 (VERIFIED) and corroborated by DCOMMERCE_LINKEDIN_PERIOD_001 (OBSERVED): Aug 2021 - Sep 2022, comprising an internship phase beginning 09.08.2021 and a full-time employee phase beginning at the documented transition date 01.10.2021 through the documented end date 19.09.2022 (no separate internship end date is asserted -- only the transition date is documented). Formal employer-side position per DCOMMERCE_REFERENCE_001: 'Junior expert' within the Management Information and Income and Costs Control Department (Planning, Control, Financial Reporting and General Accounting Directorate) -- this is the authoritative formal title and must never be silently merged with or replaced by Bora's current LinkedIn display title 'Junior Financial Data Analyst' (DCOMMERCE_LINKEDIN_PERIOD_001, OBSERVED, Bora-confirmed as his correct current public presentation, kept as a separate, distinctly-sourced fact). An earlier résumé value (title 'Financial Reporting Analyst', dates beginning Oct 2021) has been explicitly superseded by Bora's direct correction and by the independently corroborating employer letter -- that earlier value covered only the later full-time phase, not the complete relationship, and is no longer canonical. Microsoft Excel use and the 1,000+ monthly transaction figure (DCOMMERCE_EXCEL_001) remain OBSERVED-tier, candidate-supplied facts not established by the employer letter and not upgraded merely because the overall employment relationship is now VERIFIED. This is Bulgarian professional experience; it does not establish U.S. GAAP, SEC, FINRA, U.S. banking regulation, U.S. tax, U.S. payroll, or other U.S.-specific regulatory expertise."
}
