{
  "experience_id": "EXP_EDU_BRANDEIS_001",
  "experience_name": "Business Analytics (M.S.), Brandeis University",
  "experience_type": "EDUCATION",
  "organization": "Brandeis University",
  "source_of_truth": "Bora-supplied Brandeis University official-system-generated Unofficial Transcript, prepared 2026-08-28; Bora-supplied Brandeis academic-progress screen (contemporaneous view, last evaluated 2026-08-26); evidence/education/ records referencing EXP_EDU_BRANDEIS_001",
  "notes": "Canonical identity for Bora's Brandeis University graduate education. Academic unit per transcript: International Business School. Program: Business Analytics (M.S.). Academic level: Graduate. Enrollment periods, GPA, and degree-requirements-satisfied status are documented in evidence/education/ records, not restated here. This identity record does not itself assert exact dates, GPA, STEM/CIP status, or degree-conferral status."
}
