{
  "experience_id": "EXP_BULMARMA_001",
  "experience_name": "Bulmarma 2008 Ltd",
  "experience_type": "ORGANIZATIONAL_ENGAGEMENT",
  "organization": "Bulmarma 2008 Ltd",
  "source_of_truth": "Bora-supplied current professional-profile screenshot (not stored in repository); evidence/bulmarma/ records referencing EXP_BULMARMA_001",
  "notes": "Canonical identity for Bora's Bulmarma 2008 Ltd engagement. Sourced entirely from candidate-supplied current professional-profile/LinkedIn history; no offer letter, payslip, or other independently-verifiable employment record has been supplied for Bulmarma in this milestone (unlike D Commerce, for which an employer-issued Letter of Reference now exists). Canonical current identity, per Bora's explicit human correction: organization display 'Bulmarma 2008 Ltd' (superseding an earlier résumé value 'Bulmarma OOD' -- no legal-entity equivalence between 'Ltd' and 'OOD' is asserted or inferred; 'Bulmarma 2008 Ltd' is recorded only as Bora's corrected current display wording, not a verified legal-entity name), title 'Financial & Business Analyst' (consistent across both the current LinkedIn history and the superseded résumé value -- never itself in conflict), dates Sep 2022 - Nov 2023 (superseding an earlier résumé value of Nov 2024, which Bora has explicitly corrected as stale), location Sofia, Bulgaria. Bora's explicit correction resolves which factual history this repository uses; it does not itself constitute independent employer verification -- these facts remain OBSERVED, not VERIFIED, and experience_type remains ORGANIZATIONAL_ENGAGEMENT (not EMPLOYMENT) per experience.schema.json's own evidentiary-authorization guidance. This ORGANIZATIONAL_ENGAGEMENT classification documents the current evidence-authorization level only; it is not an assertion that this work was not factually employment, and any future experience-range/years-of-experience logic must read Evidence-level date facts directly rather than treating this classification as a factual-nature signal. This is Bulgarian professional experience; it does not establish U.S. GAAP, SEC, FINRA, U.S. banking regulation, U.S. tax, U.S. payroll, or other U.S.-specific regulatory expertise."
}
